,instrument,type,topic,technique_keywords,practice_goal
Exercises for Trills - Practising the Piano.pdf,piano,paper,trill technique,"['trill', 'finger independence', 'agility']",develop clear and controlled trills
The Art of Playing Fast Octaves Fluently_ Mastering the Technique.pdf,piano,paper,octave technique,"['octave', 'wrist rotation', 'endurance']",master fast and fluent octave playing
"Trill Exercises_ Piano Tips, Techniques & Examples.pdf",piano,paper,trill technique,"['trill', 'finger independence', 'agility']",develop clear and controlled trills
Piano Technique by Paul White.pdf,piano,paper,general piano technique,"['technique', 'pedagogy']",enhance overall technical and musical ability
Securing a Fast Passage - Practising the Piano.pdf,piano,paper,general piano technique,"['technique', 'pedagogy']",enhance overall technical and musical ability
Sumiko Mikimoto's piano method.pdf,piano,paper,general piano technique,"['technique', 'pedagogy']",enhance overall technical and musical ability
Pedagogy of Piano Pedaling.pdf,piano,paper,pedaling,"['pedal', 'damper control', 'legato']",improve expressive use of the sustain pedal
Jabusch20etal2009PianistsMotorSkillFollowUp.pdf,piano,paper,motor skills,"['motor learning', 'muscle memory', 'practice routines']",understand and apply motor skill principles in piano
Exploring_pedagogical_strategies_for_piano_sight-r.pdf,piano,paper,sight-reading,"['sight-reading', 'score reading', 'fluency']",enhance ability to read and perform at sight
The “Artistic Image” Concept Applied to a Fugue at the Early Stage of Piano Practice_ An Observational Study.pdf,piano,paper,general piano technique,"['technique', 'pedagogy']",enhance overall technical and musical ability
Piano_Performance_Techniques_and_Musical_Expressiv.pdf,piano,paper,expressivity,"['expressivity', 'tone control', 'rubato']",improve expressive and musical playing
Expressivity and Musical Performance_ Practice Strategies for Pianists.pdf,piano,paper,expressivity,"['expressivity', 'tone control', 'rubato']",improve expressive and musical playing
Expressive_production_of_piano_timbre_To.pdf,piano,paper,expressivity,"['expressivity', 'tone control', 'rubato']",improve expressive and musical playing
11_Basic_Practice_Methods_in_University_General_Pi.pdf,piano,paper,general piano technique,"['technique', 'pedagogy']",enhance overall technical and musical ability
An Analysis of Effective Practice Strategies for the Performing Undergraduate University-Level Pianist.pdf,piano,paper,general piano technique,"['technique', 'pedagogy']",enhance overall technical and musical ability
Managing Arpeggios - Practising the Piano.pdf,piano,paper,arpeggios,"['arpeggios', 'hand coordination', 'fluidity']",achieve smooth and even arpeggio performance
Personal_Account_on_the_Development_of_W.pdf,piano,paper,general piano technique,"['technique', 'pedagogy']",enhance overall technical and musical ability
Methodological_Principles_of_Piano_Technique_in_th.pdf,piano,paper,general piano technique,"['technique', 'pedagogy']",enhance overall technical and musical ability
Goebl2017-SpringerHandbook-PianoMovementTouch-postprint.pdf,piano,paper,general piano technique,"['technique', 'pedagogy']",enhance overall technical and musical ability
Pang.S.E.2025.IntersectionsPianoVariationsandPracticeKnow-HowasTeachingStrategiesforPianoTechniqueDevelopment.PosterPresentationThe14thMTNACollegiateChapterSymposiumNorm.pdf,piano,paper,general piano technique,"['technique', 'pedagogy']",enhance overall technical and musical ability
Continuing Abby Whiteside's Legacy_ The Research of Pianist Sophia Rosoff's Pedagogical Approach.pdf,piano,paper,alternative pedagogy,"['whole-arm technique', 'abstraction', 'emotional intention']",explore non-traditional piano teaching approaches
Fix It_ Teaching Tips for Playing Even Scales on the Piano - Yamaha Music.pdf,piano,paper,scales,"['scales', 'evenness', 'finger crossing']",master even and accurate scale playing
Piano_sight-reading_teaching_and_music_education_A.pdf,piano,paper,sight-reading,"['sight-reading', 'score reading', 'fluency']",enhance ability to read and perform at sight
Improving Your Scales_ Feature Article for Piano Professional Magazine.pdf,piano,paper,scales,"['scales', 'evenness', 'finger crossing']",master even and accurate scale playing
"Effects of Practice Strategies, Metronome Use, Meter, Hand, and Musical Function on Dual-Staved Piano Performance Accuracy and Practice Time Usage of Undergraduate.pdf",piano,paper,general piano technique,"['technique', 'pedagogy']",enhance overall technical and musical ability
Suzuki_Mitchell_2021_researchgate.pdf,piano,paper,general piano technique,"['technique', 'pedagogy']",enhance overall technical and musical ability
